{"contract_version":"0.1","session_id":"session_example_001","scenario_id":"market-entry-001","scenario_version":"scenario-001-v0.1","started_at":"2026-08-04T05:00:00Z","ended_at":"2026-08-04T05:15:00Z","participants":[{"participant_id":"user_anon_001","speaker_type":"user","agent_role":null},{"participant_id":"ai_01","speaker_type":"ai","agent_role":"実現可能性を重視する参加者"},{"participant_id":"ai_02","speaker_type":"ai","agent_role":"費用対効果を重視する参加者"}],"messages":[{"message_id":"message_001","participant_id":"user_anon_001","speaker_type":"user","text":"効果、費用、実現性の三つで比較しませんか。","phase":"problem_definition","move":"define_criteria","start_ms":10000,"end_ms":15000,"generation_id":null},{"message_id":"message_002","participant_id":"ai_01","speaker_type":"ai","text":"その基準なら、まずアプリ施策の費用を確認しましょう。","phase":"option_comparison","move":"respond_to_question","start_ms":17000,"end_ms":22000,"generation_id":"gen_001"}],"events":[{"event_id":"event_001","event":"USER_UTTERANCE_FINALIZED","timestamp_ms":15000,"participant_id":"user_anon_001","generation_id":null},{"event_id":"event_002","event":"AI_UTTERANCE_COMMITTED","timestamp_ms":22000,"participant_id":"ai_01","generation_id":"gen_001"}],"versions":{"orchestrator_version":"orchestrator-v0.2","prompt_version":"prompt-v0.1","model_provider":"example","model_name":"example-model","model_parameters":{"temperature":0.1}},"transcript_hash":"aaaaaaaaaaaaaaaaaaaaaaaaaaaaaaaaaaaaaaaaaaaaaaaaaaaaaaaaaaaaaaaa","legacy_evaluation":null}
